{
  "event_id": "0192f3b1-5c30-7000-8000-000000000002",
  "event_type": "PaymentRequested",
  "schema_version": 1,
  "occurred_at": "2026-10-21T09:30:05Z",
  "aggregate_id": "0192f3b1-5c2e-7d10-9f00-3a2b1c4d5e70",
  "correlation_id": "req-7f3a9c1f",
  "payload": {
    "payer_account_id": "0192f3a4-0000-7000-8000-000000000002",
    "payee_account_id": "0192f3a4-0000-7000-8000-000000000900",
    "amount_minor": 1,
    "currency": "USD",
    "channel": "web",
    "device_id": null
  }
}
