{
  "event_id": "0192f3b1-5c34-7000-8000-000000000006",
  "event_type": "PaymentPosted",
  "schema_version": 1,
  "occurred_at": "2026-10-21T09:30:00.300Z",
  "aggregate_id": "0192f3b1-5c2e-7d10-9f00-3a2b1c4d5e6f",
  "correlation_id": "req-7f3a9c1e",
  "payload": {
    "transaction_id": "0192f3b1-5c2f-7a00-8b00-112233445566",
    "currency": "ZAR",
    "entries": [
      { "account_id": "0192f3a4-0000-7000-8000-000000000001", "direction": "D", "amount_minor": 25000 },
      { "account_id": "0192f3a4-0000-7000-8000-000000000900", "direction": "C", "amount_minor": 25000 }
    ]
  }
}
