{
  "event_id": "0192f3b1-5c32-7000-8000-000000000004",
  "event_type": "PaymentDecided",
  "schema_version": 1,
  "occurred_at": "2026-10-21T09:30:00.150Z",
  "aggregate_id": "0192f3b1-5c2e-7d10-9f00-3a2b1c4d5e6f",
  "correlation_id": "req-7f3a9c1e",
  "payload": {
    "decision": "approve",
    "payer_account_id": "0192f3a4-0000-7000-8000-000000000001",
    "payee_account_id": "0192f3a4-0000-7000-8000-000000000900",
    "amount_minor": 25000,
    "currency": "ZAR",
    "risk_score": 0.04,
    "model_version": "sentinel-fraud-3",
    "reasons": [
      { "feature": "amount_vs_30d_median", "contribution": 0.012 },
      { "feature": "new_device", "contribution": -0.004 }
    ],
    "score_unavailable": false
  }
}
